iro isa,70898771922,fighting,girei,Heading to San Francisco
ruth jatau,8098932754,refusal to parent,mautech,With my best girl for a few more hours in San francisco. Mmmmmfamily is wonderful!
shoe muta,9037284412,public disturbance,sabon gari,"F*** up big, or go home - AIG"
joe wayne,9021832912,stealing,sangere,Went to see the Star Trek movie last night.  Very satisfying.
bitrus ishaya,8032737822,murder,damare,"I can't wait, going to see star trek tonight!!"
iro musa,70898773222,bandits,girei,Star Trek was as good as everyone said!!
jalo jatau,8098986754,rule breaking,mautech,am loving new malcolm gladwell book - outliers
sani muta,9037281812,kidnapping,sabon gari,I highly recommend Malcolm Gladwell's 'The Tipping Point.' My next audiobook will probably be one of his as well.
hoe hama,9021898712,robbery,sangere,Malcolm Gladwell is a genius at tricking people into not realizing he's a fucking idiot
birus isa,803737822,theft,damare,"@sportsguy33 hey no offense but malcolm gladwell is a pretenious, annoying cunt and he brings you down. cant read his shit"
iro isa,70898771922,fighting,girei,RT @clashmore: http://bit.ly/SOYv7  Great article by Malcolm Gladwell.
ruth jatau,8098932754,refusal to parent,mautech,I seriously underestimated Malcolm Gladwell.  I want to meet this dude.
shoe muta,9037284412,public disturbance,sabon gari,i hate comcast right now. everything is down cable internet &amp
heyne kin,7089954634,drug abuse,shagari,Comcast sucks.
iliya iro,708999132,trafficking,shinko,The day I never have to deal with Comcast again will rank as one of the best days of my life.
hired joe,9098896767,weapon,jimeta,New blog post: Nike SB Dunk Low Premium 'White Gum' http://tr.im/lOtT
joe wayne,9021832912,prostitution,sangere,RT @SmartChickPDX: Was just told that Nike layoffs started today :-(
bitrus ishaya,8032737822,contract killing,damare,Back when I worked for Nike we had one fav word : JUST DO IT! :)
iro musa,70898773222,extortion,girei,"By the way, I'm totally inspired by this freaky Nike commercial: http://snurl.com/icgj9"
jalo jatau,8098986754,diamond smuggling,mautech,"giving weka an app engine interface, using the bird strike data for the tests, the logo is a given."
sani muta,9037281812,money laudering,sabon gari,"Brand New Canon EOS 50D 15MP DSLR Camera Canon 17-85mm IS Lens ...: Web Technology Thread, Brand New Canon EOS 5.. http://u.mavrev.com/5a3t"
hoe hama,9021898712,human trafficking,sangere,Class... The 50d is supposed to come today :)
birus isa,803737822,theft,damare,needs someone to explain lambda calculus to him! :(
iro isa,70898771922,fighting,girei,Took the Graduate Field Exam for Computer Science today.  Nothing makes you feel like more of an idiot than lambda calculus.
ruth jatau,8098932754,refusal to parent,mautech,SHOUT OUTS TO ALL EAST PALO ALTO FOR BEING IN THE BUILDIN KARIZMAKAZE 50CAL GTA! ALSO THANKS TO PROFITS OF DOOM UNIVERSAL HEMPZ CRACKA......
shoe muta,9037284412,public disturbance,sabon gari,"@legalgeekery Yeahhhhhhhhh, I wouldn't really have lived in East Palo Alto if I could have avoided it.  I guess it's only for the summer."
joe wayne,9021832912,stealing,sangere,@accannis @edog1203 Great Stanford course. Thanks for making it available to the public! Really helpful and informative for starting off!
bitrus ishaya,8032737822,murder,damare,"NVIDIA Names Stanford's Bill Dally Chief Scientist, VP Of Research http://bit.ly/Fvvg9"
iro musa,70898773222,bandits,girei,New blog post: Harvard Versus Stanford - Who Wins? http://bit.ly/MCoCo
jalo jatau,8098986754,rule breaking,mautech,@ work til 6pm... lets go lakers!!!
sani muta,9037281812,kidnapping,sabon gari,Damn you North Korea. http://bit.ly/KtMeQ
hoe hama,9021898712,robbery,sangere,Can we just go ahead and blow North Korea off the map already?
birus isa,803737822,theft,damare,"North Korea, please cease this douchebaggery. China doesn't even like you anymore. http://bit.ly/NeHSl"
iro isa,70898771922,fighting,girei,Why the hell is Pelosi in freakin China? and on whose dime?
ruth jatau,8098932754,refusal to parent,mautech,"Are YOU burning more cash $$$ than Chrysler and GM? Stop the financial tsunami. Where ""bailout"" means taking a handout!"
shoe muta,9037284412,public disturbance,sabon gari,insects have infected my spinach plant :(
heyne kin,7089954634,drug abuse,shagari,wish i could catch every mosquito in the world n burn em slowly.they been bitin the shit outta me 2day.mosquitos are the assholes of insects
iliya iro,708999132,trafficking,shinko,"just got back from church, and I totally hate insects."
hired joe,9098896767,weapon,jimeta,Just got mcdonalds goddam those eggs make me sick. O yeah Laker up date go lakers. Not much of an update? Well it's true so suck it
joe wayne,9021832912,prostitution,sangere,omgg i ohhdee want mcdonalds damn i wonder if its open lol =]
bitrus ishaya,8032737822,contract killing,damare,History exam studying ugh
iro musa,70898773222,extortion,girei,"I hate revision, it's so boring! I am totally unprepared for my exam tomorrow :( Things are not looking good..."
jalo jatau,8098986754,diamond smuggling,mautech,"Higher physics exam tommorow, not lookin forward to it much :("
sani muta,9037281812,money laudering,sabon gari,"It's a bank holiday, yet I'm only out of work now. Exam season sucks:("
hoe hama,9021898712,human trafficking,sangere,Cheney and Bush are the real culprits - http://fwix.com/article/939496
birus isa,803737822,theft,damare,Life?s a bitch? and so is Dick Cheney. #p2 #bipart #tlot #tcot #hhrs #GOP #DNC http://is.gd/DjyQ
iro isa,70898771922,fighting,girei,"Dick Cheney's dishonest speech about torture, terror, and Obama. -Fred Kaplan Slate. http://is.gd/DiHg"
ruth jatau,8098932754,refusal to parent,mautech,"""The Republican party is a bunch of anti-abortion zealots who couldn't draw flies to a dump."" -- Neal Boortz (just now, on the radio)"
shoe muta,9037284412,public disturbance,sabon gari,is Twitter's connections API broken? Some tweets didn't make it to Twitter...
joe wayne,9021832912,stealing,sangere,"i srsly hate the stupid twitter API timeout thing, soooo annoying!!!!! :("
bitrus ishaya,8032737822,murder,damare,"@psychemedia I really liked @kswedberg's ""Learning jQuery"" book. http://bit.ly/pg0lT is worth a look too"
iro musa,70898773222,bandits,girei,jQuery UI 1.6 Book Review - http://cfbloggers.org/?c=30631
jalo jatau,8098986754,rule breaking,mautech,"Very Interesting Ad from Adobe by Goodby, Silverstein &amp; Partners - YouTube - Adobe CS4: Le Sens Propre http://bit.ly/VprpT"
sani muta,9037281812,kidnapping,sabon gari,Goodby Silverstein agency new site! http://www.goodbysilverstein.com/ Great!
hoe hama,9021898712,robbery,sangere,"RT @designplay Goodby, Silverstein's new site: http://www.goodbysilverstein.com/ I enjoy it. *nice find!*"
birus isa,803737822,theft,damare,The ever amazing Psyop and Goodby Silverstein &amp
iro isa,70898771922,fighting,girei,top ten most watched on Viral-Video Chart.  Love the nike #mostvaluablepuppets campaign from Wieden &amp
ruth jatau,8098932754,refusal to parent,mautech,zomg!!! I have a G2!!!!!!!
shoe muta,9037284412,public disturbance,sabon gari,Ok so lots of buzz from IO2009 but how lucky are they - a Free G2!! http://is.gd/Hyzl
heyne kin,7089954634,drug abuse,shagari,just got a free G2 android at google i/o!!!
iliya iro,708999132,trafficking,shinko,Guess I'll be retiring my G1 and start using my developer G2 woot #googleio
hired joe,9098896767,weapon,jimeta,At GWT fireside chat @googleio
joe wayne,9021832912,prostitution,sangere,I am happy for Philip being at GoogleIO today
bitrus ishaya,8032737822,contract killing,damare,Lakers played great!  Cannot wait for Thursday night Lakers vs. ???
iro musa,70898773222,extortion,girei,"Hi there, does anyone have a great source for advice on viral marketing?... http://link.gs/YtZ8"
jalo jatau,8098986754,diamond smuggling,mautech,Judd Apatow creates fake sitcom on NBC.com to market his new movie... viral marketing at its best. http://is.gd/K0yK
sani muta,9037281812,money laudering,sabon gari,"Here's A case study on how to use viral marketing to add over 10,000 people to your list http://snipr.com/i50oz"
hoe hama,9021898712,human trafficking,sangere,VIRAL MARKETING FAIL. This Acia Pills brand oughta get shut down for hacking into people's messenger's.  i get 5-6 msgs in a day! Arrrgh!
birus isa,803737822,theft,damare,watching Night at The Museum . Lmao
iro isa,70898771922,fighting,girei,i loved night at the museum!!!
ruth jatau,8098932754,refusal to parent,mautech,going to see the new night at the museum  movie with my family oh boy a three year old in the movies fuin
bitrus ishaya,8032737822,contract killing,damare,just got back from the movies.  went to see the new night at the museum with rachel.  it was good
iro musa,70898773222,extortion,girei,Just saw the new Night at the Museum movie...it was...okay...lol 7\10
jalo jatau,8098986754,diamond smuggling,mautech,Going to see night at the museum 2 with tall boy
sani muta,9037281812,money laudering,sabon gari,@shannyoday I will take you on a date to see night at the museum 2 whenever you want...it looks soooooo good
hoe hama,9021898712,human trafficking,sangere,no watching The Night At The Museum. Getting Really Good
birus isa,803737822,theft,damare,"Night at the Museum, Wolverine and junk food - perfect monday!"
iro isa,70898771922,fighting,girei,saw night at the museum 2 last night.. pretty crazy movie.. but the cast was awesome so it was well worth it. Robin Williams forever!
ruth jatau,8098932754,refusal to parent,mautech,I saw Night at the Museum: Battle of the Swithsonian today. It was okay. Your typical [kids] Ben Stiller movie.
shoe muta,9037284412,public disturbance,sabon gari,Taking Katie to see Night at the Museum.  (she picked it)
joe wayne,9021832912,stealing,sangere,Night at the Museum tonite instead of UP. :( oh well. that 4 yr old better enjoy it. LOL
bitrus ishaya,8032737822,murder,damare,GM says expects announcment on sale of Hummer soon - Reuters: WDSUGM says expects announcment on sale of Hummer .. http://bit.ly/4E1Fv
iro musa,70898773222,bandits,girei,It's unfortunate that after the Stimulus plan was put in place twice to help GM on the back of the American people has led to the inevitable
jalo jatau,8098986754,rule breaking,mautech,Tell me again why we are giving more $$ to GM?? We should use that $ for all the programs that support the unemployed.
jalo jatau,8098986754,diamond smuggling,mautech,@jdreiss oh yes but if GM dies it will only be worth more boo hahaha
sani muta,9037281812,money laudering,sabon gari,Time Warner cable is down again 3rd time since Memorial Day bummer!
