heyne kin,7089954634,cybercirme,shagari,New blog post: Nike SB Dunk Low Premium 'White Gum' http://tr.im/lOtT
iliya iro,708999132,fraud,shinko,RT @SmartChickPDX: Was just told that Nike layoffs started today :-(
hired joe,9098896767,scams,jimeta,Back when I worked for Nike we had one fav word : JUST DO IT! :)
joe wayne,9021832912,stealing,sangere,"By the way, I'm totally inspired by this freaky Nike commercial: http://snurl.com/icgj9"
bitrus ishaya,8032737822,murder,damare,"giving weka an app engine interface, using the bird strike data for the tests, the logo is a given."
iro musa,70898773222,bandits,girei,"Brand New Canon EOS 50D 15MP DSLR Camera Canon 17-85mm IS Lens ...: Web Technology Thread, Brand New Canon EOS 5.. http://u.mavrev.com/5a3t"
jalo jatau,8098986754,rule breaking,mautech,Class... The 50d is supposed to come today :)
sani muta,9037281812,kidnapping,sabon gari,needs someone to explain lambda calculus to him! :(
hoe hama,9021898712,robbery,sangere,Took the Graduate Field Exam for Computer Science today.  Nothing makes you feel like more of an idiot than lambda calculus.
birus isa,803737822,theft,damare,SHOUT OUTS TO ALL EAST PALO ALTO FOR BEING IN THE BUILDIN KARIZMAKAZE 50CAL GTA! ALSO THANKS TO PROFITS OF DOOM UNIVERSAL HEMPZ CRACKA......
iro isa,70898771922,fighting,girei,"@legalgeekery Yeahhhhhhhhh, I wouldn't really have lived in East Palo Alto if I could have avoided it.  I guess it's only for the summer."
ruth jatau,8098932754,refusal to parent,mautech,@accannis @edog1203 Great Stanford course. Thanks for making it available to the public! Really helpful and informative for starting off!
shoe muta,9037284412,public disturbance,sabon gari,"NVIDIA Names Stanford's Bill Dally Chief Scientist, VP Of Research http://bit.ly/Fvvg9"
heyne kin,7089954634,drug abuse,shagari,New blog post: Harvard Versus Stanford - Who Wins? http://bit.ly/MCoCo
iliya iro,708999132,trafficking,shinko,@ work til 6pm... lets go lakers!!!
hired joe,9098896767,weapon,jimeta,Damn you North Korea. http://bit.ly/KtMeQ
joe wayne,9021832912,prostitution,sangere,Can we just go ahead and blow North Korea off the map already?
bitrus ishaya,8032737822,contract killing,damare,"North Korea, please cease this douchebaggery. China doesn't even like you anymore. http://bit.ly/NeHSl"
iro musa,70898773222,extortion,girei,Why the hell is Pelosi in freakin China? and on whose dime?
jalo jatau,8098986754,diamond smuggling,mautech,"Are YOU burning more cash $$$ than Chrysler and GM? Stop the financial tsunami. Where ""bailout"" means taking a handout!"
sani muta,9037281812,money laudering,sabon gari,insects have infected my spinach plant :(
hoe hama,9021898712,human trafficking,sangere,wish i could catch every mosquito in the world n burn em slowly.they been bitin the shit outta me 2day.mosquitos are the assholes of insects
birus isa,803737822,theft,damare,"just got back from church, and I totally hate insects."
iro isa,70898771922,fighting,girei,Just got mcdonalds goddam those eggs make me sick. O yeah Laker up date go lakers. Not much of an update? Well it's true so suck it
ruth jatau,8098932754,refusal to parent,mautech,omgg i ohhdee want mcdonalds damn i wonder if its open lol =]
shoe muta,9037284412,public disturbance,sabon gari,History exam studying ugh
joe wayne,9021832912,stealing,sangere,"I hate revision, it's so boring! I am totally unprepared for my exam tomorrow :( Things are not looking good..."
bitrus ishaya,8032737822,murder,damare,"Higher physics exam tommorow, not lookin forward to it much :("
iro musa,70898773222,bandits,girei,"It's a bank holiday, yet I'm only out of work now. Exam season sucks:("
jalo jatau,8098986754,rule breaking,mautech,Cheney and Bush are the real culprits - http://fwix.com/article/939496
sani muta,9037281812,kidnapping,sabon gari,Life?s a bitch? and so is Dick Cheney. #p2 #bipart #tlot #tcot #hhrs #GOP #DNC http://is.gd/DjyQ
hoe hama,9021898712,robbery,sangere,"Dick Cheney's dishonest speech about torture, terror, and Obama. -Fred Kaplan Slate. http://is.gd/DiHg"
birus isa,803737822,theft,damare,"""The Republican party is a bunch of anti-abortion zealots who couldn't draw flies to a dump."" -- Neal Boortz (just now, on the radio)"
iro isa,70898771922,fighting,girei,is Twitter's connections API broken? Some tweets didn't make it to Twitter...
ruth jatau,8098932754,refusal to parent,mautech,"i srsly hate the stupid twitter API timeout thing, soooo annoying!!!!! :("
shoe muta,9037284412,public disturbance,sabon gari,"@psychemedia I really liked @kswedberg's ""Learning jQuery"" book. http://bit.ly/pg0lT is worth a look too"
heyne kin,7089954634,drug abuse,shagari,jQuery UI 1.6 Book Review - http://cfbloggers.org/?c=30631
iliya iro,708999132,trafficking,shinko,"Very Interesting Ad from Adobe by Goodby, Silverstein &amp; Partners - YouTube - Adobe CS4: Le Sens Propre http://bit.ly/VprpT"
hired joe,9098896767,weapon,jimeta,Goodby Silverstein agency new site! http://www.goodbysilverstein.com/ Great!
joe wayne,9021832912,prostitution,sangere,"RT @designplay Goodby, Silverstein's new site: http://www.goodbysilverstein.com/ I enjoy it. *nice find!*"
bitrus ishaya,8032737822,contract killing,damare,The ever amazing Psyop and Goodby Silverstein &amp
iro musa,70898773222,extortion,girei,top ten most watched on Viral-Video Chart.  Love the nike #mostvaluablepuppets campaign from Wieden &amp
jalo jatau,8098986754,diamond smuggling,mautech,zomg!!! I have a G2!!!!!!!
sani muta,9037281812,money laudering,sabon gari,Ok so lots of buzz from IO2009 but how lucky are they - a Free G2!! http://is.gd/Hyzl
hoe hama,9021898712,human trafficking,sangere,just got a free G2 android at google i/o!!!
birus isa,803737822,theft,damare,Guess I'll be retiring my G1 and start using my developer G2 woot #googleio
iro isa,70898771922,fighting,girei,At GWT fireside chat @googleio
ruth jatau,8098932754,refusal to parent,mautech,I am happy for Philip being at GoogleIO today
shoe muta,9037284412,public disturbance,sabon gari,Lakers played great!  Cannot wait for Thursday night Lakers vs. ???
joe wayne,9021832912,stealing,sangere,"Hi there, does anyone have a great source for advice on viral marketing?... http://link.gs/YtZ8"
bitrus ishaya,8032737822,murder,damare,Judd Apatow creates fake sitcom on NBC.com to market his new movie... viral marketing at its best. http://is.gd/K0yK
iro musa,70898773222,bandits,girei,"Here's A case study on how to use viral marketing to add over 10,000 people to your list http://snipr.com/i50oz"
jalo jatau,8098986754,rule breaking,mautech,VIRAL MARKETING FAIL. This Acia Pills brand oughta get shut down for hacking into people's messenger's.  i get 5-6 msgs in a day! Arrrgh!
sani muta,9037281812,kidnapping,sabon gari,watching Night at The Museum . Lmao
hoe hama,9021898712,robbery,sangere,i loved night at the museum!!!
birus isa,803737822,theft,damare,going to see the new night at the museum  movie with my family oh boy a three year old in the movies fuin
iro isa,70898771922,fighting,girei,just got back from the movies.  went to see the new night at the museum with rachel.  it was good
ruth jatau,8098932754,refusal to parent,mautech,Just saw the new Night at the Museum movie...it was...okay...lol 7\10
shoe muta,9037284412,public disturbance,sabon gari,Going to see night at the museum 2 with tall boy
heyne kin,7089954634,drug abuse,shagari,@shannyoday I will take you on a date to see night at the museum 2 whenever you want...it looks soooooo good
iliya iro,708999132,trafficking,shinko,no watching The Night At The Museum. Getting Really Good
hired joe,9098896767,weapon,jimeta,"Night at the Museum, Wolverine and junk food - perfect monday!"
joe wayne,9021832912,prostitution,sangere,saw night at the museum 2 last night.. pretty crazy movie.. but the cast was awesome so it was well worth it. Robin Williams forever!
bitrus ishaya,8032737822,contract killing,damare,I saw Night at the Museum: Battle of the Swithsonian today. It was okay. Your typical [kids] Ben Stiller movie.
iro musa,70898773222,extortion,girei,Taking Katie to see Night at the Museum.  (she picked it)
jalo jatau,8098986754,diamond smuggling,mautech,Night at the Museum tonite instead of UP. :( oh well. that 4 yr old better enjoy it. LOL
sani muta,9037281812,money laudering,sabon gari,GM says expects announcment on sale of Hummer soon - Reuters: WDSUGM says expects announcment on sale of Hummer .. http://bit.ly/4E1Fv
hoe hama,9021898712,human trafficking,sangere,It's unfortunate that after the Stimulus plan was put in place twice to help GM on the back of the American people has led to the inevitable
birus isa,803737822,theft,damare,Tell me again why we are giving more $$ to GM?? We should use that $ for all the programs that support the unemployed.
iro isa,70898771922,fighting,girei,@jdreiss oh yes but if GM dies it will only be worth more boo hahaha
ruth jatau,8098932754,refusal to parent,mautech,Time Warner cable is down again 3rd time since Memorial Day bummer!
shoe muta,9037284412,public disturbance,sabon gari,"I would rather pay reasonable yearly taxes for ""free"" fast internet, than get gouged by Time Warner for a slow connection."
joe wayne,9021832912,stealing,sangere,NOOOOOOO my DVR just died and I was only half way through the EA presser. Hate you Time Warner
bitrus ishaya,8032737822,murder,damare,F*ck Time Warner Cable!!! You f*cking suck balls!!! I have a $700 HD tv &amp
iro musa,70898773222,bandits,girei,time warner has the worse customer service ever. I will never use them again
jalo jatau,8098986754,rule breaking,mautech,Time warner is the devil. Worst possible time for the Internet to go out.
sani muta,9037281812,kidnapping,sabon gari,Fuck no internet damn time warner!
hoe hama,9021898712,robbery,sangere,time warner really picks the worst time to not work. all i want to do is get to mtv.com so i can watch the hills. wtfffff.
birus isa,803737822,theft,damare,I hate Time Warner! Soooo wish I had Vios. Cant watch the fricken Mets game w/o buffering. I feel like im watching free internet porn.
iro isa,70898771922,fighting,girei,Ahh...got rid of stupid time warner today &amp
ruth jatau,8098932754,refusal to parent,mautech,Time Warner's HD line up is crap.
shoe muta,9037284412,public disturbance,sabon gari,is being fucked by time warner cable. didnt know modems could explode. and Susan Boyle sucks too!
heyne kin,7089954634,drug abuse,shagari,Time Warner Cable Pulls the Plug on 'The Girlfriend Experience' - (www.tinyurl.com/m595fk)
iliya iro,708999132,trafficking,shinko,Time Warner Cable slogan: Where calling it a day at 2pm Happens.
hired joe,9098896767,weapon,jimeta,"Rocawear Heads to China, Building 300 Stores  - http://tinyurl.com/nofet3"
joe wayne,9021832912,prostitution,sangere,"Climate focus turns to Beijing: The United Nations, the US and European governments have called on China to co-o.. http://tinyurl.com/lto92n"
bitrus ishaya,8032737822,contract killing,damare,myfoxdc Barrie Students Back from Trip to China: A Silver Spring high school's class trip to China has en.. http://tinyurl.com/nlhqba
iro musa,70898773222,extortion,girei,"Three China aerospace giants develop Tianjin Binhai  New Area,  22.9 B yuan invested   http://bit.ly/mMiDv"
jalo jatau,8098986754,diamond smuggling,mautech,http://xi.gs/04FO GM CEO: China will continue to be key partner
sani muta,9037281812,money laudering,sabon gari,RT @LATimesautos is now the time to buy a GM car? http://bit.ly/nRzlu
hoe hama,9021898712,human trafficking,sangere,Recovering from surgery..wishing @julesrenner was here :(
birus isa,803737822,theft,damare,"My wrist still hurts. I have to get it looked at. I HATE the dr/dentist/scary places. :( Time to watch Eagle eye. If you want to join, txt!"
iro isa,70898771922,fighting,girei,Dentist tomorrow. Have to brush well in the morning. Like I make my hair all nice before I get it cut. Why?
ruth jatau,8098932754,refusal to parent,mautech,"THE DENTIST LIED! "" U WON'T FEEL ANY DISCOMORT! PROB WON'T EVEN NEED PAIN PILLS"" MAN U TWIPPIN THIS SHIT HURT!! HOW MANY PILLS CAN I TAKE!!"
shoe muta,9037284412,public disturbance,sabon gari,@kirstiealley my dentist is great but she's expensive...=(
heyne kin,7089954634,cybercirme,shagari,@kirstiealley Pet Dentist http://www.funnyville.com/fv/pictures/dogdentures.shtml
iliya iro,708999132,fraud,shinko,is studing math 
hired joe,9098896767,scams,jimeta,my dentist was wrong... WRONG
joe wayne,9021832912,stealing,sangere,Going to the dentist later.:|
bitrus ishaya,8032737822,murder,damare,Son has me looking at cars online.  I hate car shopping.  Would rather go to the dentist!  Anyone with a good car at a good price to sell?
iro musa,70898773222,bandits,girei,NCAA Baseball Super Regional - Rams Club http://bit.ly/Ro7nx
jalo jatau,8098986754,rule breaking,mautech,just started playing Major League Baseball 2K9. http://raptr.com/H3LLGWAR
sani muta,9037281812,kidnapping,sabon gari,Cardinals baseball advance to Super Regionals. Face CS-Fullerton Friday.
hoe hama,9021898712,robbery,sangere,Sony coupon code.. Expires soon.. http://www.coupondork.com/r/1796
birus isa,803737822,theft,damare,waiting in line at safeway.
iro isa,70898771922,fighting,girei,luke and i got stopped walking out of safeway and asked to empty our pockets and lift our shirts. how jacked up is that?
ruth jatau,8098932754,refusal to parent,mautech,Did not realize there is a gym above Safeway!
shoe muta,9037284412,public disturbance,sabon gari,"@XPhile1908 I have three words for you: ""Safeway dot com"""
heyne kin,7089954634,drug abuse,shagari,Safeway is very rock n roll tonight
iliya iro,708999132,trafficking,shinko,Bout to hit safeway I gotta eat
hired joe,9098896767,weapon,jimeta,Jake's going to safeway!
joe wayne,9021832912,prostitution,sangere,Found a safeway. Picking up a few staples.
bitrus ishaya,8032737822,contract killing,damare,Safeway Super-marketing via mobile coupons http://bit.ly/ONH7w
iro musa,70898773222,extortion,girei,The safeway bathroom still smells like ass!
jalo jatau,8098986754,diamond smuggling,mautech,"At safeway on elkhorn, they move like they're dead!"
sani muta,9037281812,money laudering,sabon gari,Your Normal Weight (and How to Get There) ? Normal Eating Blog http://bit.ly/ZeT8O
hoe hama,9021898712,human trafficking,sangere,Is Eating and Watching Movies....
birus isa,803737822,theft,damare,eating sashimi
iro isa,70898771922,fighting,girei,is eating  home made yema
ruth jatau,8098932754,refusal to parent,mautech,eating cake
shoe muta,9037284412,public disturbance,sabon gari,i love Dwight Howard's vitamin water commercial... now i wish he was with NIKE and not adidas. lol.
joe wayne,9021832912,stealing,sangere,Found NOTHING at Nike Factory :/ Off to Banana Republic Outlet! http://myloc.me/2zic
bitrus ishaya,8032737822,murder,damare,iPhone May Get Radio Tagging and Nike  : Recently-released iTunes version 8.2 suggests that VoiceOver functional.. http://tinyurl.com/oq5ctc
iro musa,70898773222,bandits,girei,is lovin his Nike  already and that's only from running on the spot in his bedroom
jalo jatau,8098986754,rule breaking,mautech,Launched! http://imgsearch.net  #imgsearch #ajax #jquery #webapp
sani muta,9037281812,kidnapping,sabon gari,@matthewcyan I finally got around to using jquery to make my bio collapse. Yay for slide animations.
hoe hama,9021898712,robbery,sangere,RT @jquery: The Ultimate jQuery List - http://jquerylist.com/
birus isa,803737822,theft,damare,I just extracted and open-sourced a jQuery plugin from Stormweight to highlight text with a regular expression: http://bit.ly/ybJKb
iro isa,70898771922,fighting,girei,@anna_debenham what was the php jquery hack?
ruth jatau,8098932754,refusal to parent,mautech,jQuery Cheat Sheet http://www.javascripttoolbox.com/jquery/cheatsheet/
shoe muta,9037284412,public disturbance,sabon gari,Beginning JavaScript and CSS Development with jQuery #javascript #css #jquery http://bit.ly/TO3e5
heyne kin,7089954634,drug abuse,shagari,"@PDubyaD right!!! LOL we'll get there!! I have high expectations, Warren Buffet style."
iliya iro,708999132,trafficking,shinko,"RT @blknprecious1: RT GREAT @dbroos ""Someone's sitting in the shade today because someone planted a tree a long time ago.""- Warren Buffet"
hired joe,9098896767,weapon,jimeta,Warren Buffet on the economy http://ping.fm/Lau0p
joe wayne,9021832912,prostitution,sangere,"Warren Buffet became (for a time) the richest man in the United States, not by working but investing in 1 Big idea which lead to the fortune"
bitrus ishaya,8032737822,contract killing,damare,"According to the create a school, Notre Dame will have 7 receivers in NCAA 10 at 84 or higher rating :) *sweet*"
iro musa,70898773222,extortion,girei,All-Star Basketball Classic Tuesday Features Top Talent: Chattanooga's Notre Dame High School will play host.. http://bit.ly/qltJA
jalo jatau,8098986754,diamond smuggling,mautech,@BlondeBroad it's definitely under warranty &amp
sani muta,9037281812,money laudering,sabon gari,"RT Look, Available !Amazon Kindle2 &amp; Kindle DX, Get it Here: http://short.to/87ub The Top Electronic Book Reader Period, free 2 day ship ..."
hoe hama,9021898712,human trafficking,sangere,Time Warner Road Runner customer support here absolutely blows. I hate not having other high-speed net options. I'm ready to go nuclear.
birus isa,803737822,theft,damare,Time Warner cable phone reps r dumber than nails!!!!! UGH! Cable was working 10 mins ago now its not WTF!
iro isa,70898771922,fighting,girei,@siratomofbones we tried but Time Warner wasn't being nice so we recorded today. :)
ruth jatau,8098932754,refusal to parent,mautech,OMG - time warner f'ed up my internet install - instead of today  its now NEXT saturday - another week w/o internet! &amp
shoe muta,9037284412,public disturbance,sabon gari,"wth..i have never seen a line this loooong at time warner before, ugh."
joe wayne,9021832912,stealing,sangere,Impatiently awaiting the arrival of the time warner guy. It's way too pretty to be inside all afternoon
bitrus ishaya,8032737822,murder,damare,Man accosts Roger Federer during French Open http://ff.im/3HCPT
iro musa,70898773222,bandits,girei,Naive Bayes using EM for Text Classification. Really Frustrating...
jalo jatau,8098986754,rule breaking,mautech,We went to Stanford University today. Got a tour. Made me want to go back to college. It's also decided all of our kids will go there.
sani muta,9037281812,kidnapping,sabon gari,Investigation pending on death of Stanford CS prof / Google mentor Rajeev Motwani http://bit.ly/LwOUR tip @techmeme
hoe hama,9021898712,robbery,sangere,"I'm going to bed. It was a successful weekend. Stanford, here I come."
birus isa,803737822,theft,damare,"@KarrisFoxy If you're being harassed by calls about your car warranty, changing your number won't fix that. They call every number. #d-bags"
iro isa,70898771922,fighting,girei,Just blocked United Blood Services using Google Voice. They call more than those Car Warranty guys.
ruth jatau,8098932754,refusal to parent,mautech,#at&amp
shoe muta,9037284412,public disturbance,sabon gari,@broskiii OH SNAP YOU WORK AT AT&amp
heyne kin,7089954634,drug abuse,shagari,@Mbjthegreat i really dont want AT&amp
iliya iro,708999132,trafficking,shinko,"I say we just cut out the small talk: AT&amp;T's new slogan: F__k you, give us your money. (Apologies to Bob Geldof.)"
hired joe,9098896767,weapon,jimeta,pissed about at&amp
joe wayne,9021832912,prostitution,sangere,Safari 4 is fast :) Even on my shitty AT&amp
bitrus ishaya,8032737822,contract killing,damare,@ims What is AT&amp
iro musa,70898773222,extortion,girei,@springsingfiend @dvyers @sethdaggett @jlshack AT&amp
jalo jatau,8098986754,diamond smuggling,mautech,"@MMBarnhill yay, glad you got the phone! Still, damn you, AT&amp;T."
sani muta,9037281812,money laudering,sabon gari,Google Wave Developer Sandbox Account Request http://bit.ly/2NYlc
hoe hama,9021898712,human trafficking,sangere,"Talk is Cheap: Bing that, I?ll stick with Google. http://bit.ly/XC3C8"
birus isa,803737822,theft,damare,"@defsounds WTF is the point of deleting tweets if they can still be found in summize and searches? Twitter, please fix that. Thanks and bye"
iro isa,70898771922,fighting,girei,@mattcutts have google profiles stopped showing up in searches? cant see them anymore
ruth jatau,8098932754,refusal to parent,mautech,@ArunBasilLal I love Google Translator too ! :D Good day mate !
shoe muta,9037284412,public disturbance,sabon gari,reading on my new Kindle2!
joe wayne,9021832912,stealing,sangere,My Kindle2 came and I LOVE it! :)
bitrus ishaya,8032737822,murder,damare,"LOVING my new Kindle2.  Named her Kendra in case u were wondering. The ""cookbook"" is THE tool cuz it tells u all the tricks!  Best gift EVR!"
iro musa,70898773222,bandits,girei,The real AIG scandal / http://bit.ly/b82Px
jalo jatau,8098986754,rule breaking,mautech,Any twitter to aprs apps yet?
sani muta,9037281812,kidnapping,sabon gari,45 Pros You Should Be Following on Twitter - http://is.gd/sMbZ
hoe hama,9021898712,robbery,sangere,Obama is quite a good comedian! check out his dinner speech on CNN :) very funny jokes.
birus isa,803737822,theft,damare,"' Barack Obama shows his funny side "" &gt;&gt; http://tr.im/l0gY !! Great speech.."
iro isa,70898771922,fighting,girei,"I like this guy : ' Barack Obama shows his funny side "" &gt;&gt; http://tr.im/l0gY !!"
ruth jatau,8098932754,refusal to parent,mautech,Obama's speech was pretty awesome last night! http://bit.ly/IMXUM
shoe muta,9037284412,public disturbance,sabon gari,"Reading  ""Bill Clinton Fail - Obama Win?"" http://tinyurl.com/pcyxj7"
heyne kin,7089954634,drug abuse,shagari,Obama More Popular Than U.S. Among Arabs: Survey: President Barack Obama's popularity in leading Arab countries .. http://tinyurl.com/prlvqu
iliya iro,708999132,trafficking,shinko,Obama's got JOKES!! haha just got to watch a bit of his after dinner speech from last night... i'm in love with mr. president 
hired joe,9098896767,weapon,jimeta,LEbron james got in a car accident i guess..just heard it on evening news...wow i cant believe it..will he be ok ? http://twtad.com/69750
joe wayne,9021832912,prostitution,sangere,is it me or is this the best the playoffs have been in years oh yea lebron and melo in the finals
bitrus ishaya,8032737822,contract killing,damare,"@khalid0456 No, Lebron is the best"
iro musa,70898773222,extortion,girei,@the_real_usher LeBron is cool.  I like his personality...he has good character.
jalo jatau,8098986754,diamond smuggling,mautech,Watching Lebron highlights. Damn that niggas good
sani muta,9037281812,money laudering,sabon gari,@Lou911 Lebron is MURDERING shit.
hoe hama,9021898712,human trafficking,sangere,@uscsports21 LeBron is a monsta and he is only 24. SMH The world ain't ready.
birus isa,803737822,theft,damare,@cthagod when Lebron is done in the NBA he will probably be greater than Kobe. Like u said Kobe is good but there alot of 'good' players.
iro isa,70898771922,fighting,girei,KOBE IS GOOD BT LEBRON HAS MY VOTE
ruth jatau,8098932754,refusal to parent,mautech,Kobe is the best in the world not lebron .
shoe muta,9037284412,public disturbance,sabon gari,"@asherroth World Cup 2010 Access?? Damn, that's a good look!"
heyne kin,7089954634,cybercirme,shagari,Just bought my tickets for the 2010 FIFA World Cup in South Africa. Its going to be a great summer. http://bit.ly/9GEZI
iliya iro,708999132,fraud,shinko,Share: Disruption...Fred Wilson's slides for his talk at Google HQ  http://bit.ly/Bo8PG
hired joe,9098896767,scams,jimeta,I have to go to Booz Allen Hamilton for a 2hr meeting :(  But then i get to go home :)
joe wayne,9021832912,stealing,sangere,"The great Indian tamasha truly will unfold from May 16, the result day for Indian General Election."
bitrus ishaya,8032737822,murder,damare,"@crlane I have the Kindle2. I've seen pictures of the DX, but haven't seen it in person. I love my Kindle - I'm on it everyday."
iro musa,70898773222,bandits,girei,@criticalpath Such an awesome idea - the  continual learning program with a Kindle2  http://bit.ly/1ZLfF
jalo jatau,8098986754,rule breaking,mautech,ok.. do nothing.. just thinking about 40D
sani muta,9037281812,kidnapping,sabon gari,"@faithbabywear Ooooh, what model are you getting??? I have the 40D and LOVE LOVE LOVE LOVE it!"
hoe hama,9021898712,robbery,sangere,The Times of India: The wonder that is India's election. http://bit.ly/p7u1H
birus isa,803737822,theft,damare,http://is.gd/ArUJ Good video from Google on using search options.
iro isa,70898771922,fighting,girei,@ambcharlesfield lol. Ah my skin is itchy :( damn lawnmowing.
ruth jatau,8098932754,refusal to parent,mautech,itchy back!! dont ya hate it!
shoe muta,9037284412,public disturbance,sabon gari,Stanford Charity Fashion Show a top draw http://cli.gs/NeNuAH
heyne kin,7089954634,drug abuse,shagari,Stanford University?s Facebook Profile is One of the Most Popular Official University Pages - http://tinyurl.com/p5b3fl
iliya iro,708999132,trafficking,shinko,Lyx is cool.
hired joe,9098896767,weapon,jimeta,SOOO DISSAPOiNTED THEY SENT DANNY GOKEY HOME... YOU STiLL ROCK ...DANNY ... MY HOMETOWN HERO !! YEAH MiLROCKEE!!
joe wayne,9021832912,prostitution,sangere,"RT @PassionModel 'American Idol' fashion: Adam Lambert tones down, Danny Gokey cute ... http://cli.gs/7JWSHV"
bitrus ishaya,8032737822,contract killing,damare,@dannygokey I love you DANNY GOKEY!! :)
iro musa,70898773222,extortion,girei,RT @justindavey: RT @tweetmeme GM OnStar now instantly sends accident location coordinates to 911 | GPS Obsessed http://bit.ly/16szL1
jalo jatau,8098986754,diamond smuggling,mautech,so tired. i didn't sleep well at all last night.
sani muta,9037281812,money laudering,sabon gari,Boarding plane for San Francisco in 1 hour
hoe hama,9021898712,human trafficking,sangere,bonjour San Francisco. My back hurts from last night..
birus isa,803737822,theft,damare,"breakers. in San Francisco, CA http://loopt.us/4v88Bw.t"
